Post_Title,Username,Comment,Date,Score
Bought iPhone 17 instead of Oneplus 15 and heavily regretting the decision,Fearless_Purchase406,want impressive fancy stuff would take samsung base using want often play game perfect heating issue manageable play game definitely heat issue overheating mention hardcore fan android would chose apple,2026-04-30,19
Bought iPhone 17 instead of Oneplus 15 and heavily regretting the decision,robblake44,question switch iphone loved android curious iphone pretty much whole way buddy got deal samsung used week gave back since phone sell worth something get one plus,2026-04-30,21
Bought iPhone 17 instead of Oneplus 15 and heavily regretting the decision,Ash16pm,sorry found great one best iphones ever battery life great last day remember small phone tried android via samsung couple time always came crawling back general people start android io stay life everyone people pro max better phone heavy user say battery shit small phone moderate enough bet used large android bug defence unacceptable found mine since io thing gotten much better improving would rather phone one plus tried pro awful thing ever touched life going leave least buy samsung massive step,2026-04-30,20
Bought iPhone 17 instead of Oneplus 15 and heavily regretting the decision,Soviet-Anime-Hunter,wanna ruin thing oneplus shutting part unless alright last phone better going another brand,2026-04-30,15
Bought iPhone 17 instead of Oneplus 15 and heavily regretting the decision,kuulenkylla,face siri work good one swipe search enough stay apple instead samsung android might bootleg zip tie trick almost imitate feature,2026-04-30,5
Bought iPhone 17 instead of Oneplus 15 and heavily regretting the decision,only2char,hardcore android issue android choose iphone first place know big battery size difference two,2026-04-30,3
Bought iPhone 17 instead of Oneplus 15 and heavily regretting the decision,Apollopayne,iphone nearly month got hot average hr screen time daily battery youtube call texting shopping social scrolling best iphone long time,2026-04-30,4
Bought iPhone 17 instead of Oneplus 15 and heavily regretting the decision,Gold-Unit-4093,always sell buy oneplus,2026-04-30,3
Bought iPhone 17 instead of Oneplus 15 and heavily regretting the decision,Ok_Advertising8511,iphone android samsung honor infinix say true battery life base decent way better samsung honor definitely infinix budget weak phone consume much battery enough whole day girlfriend last even day day pro max hardcore user bug happen io experience io since io never like io always like one new version add new stuff next one aim absolute optimisation io less stable io fully optimised always like surely say io way stable yeah io clearly unstable version ever agree current state io less stable smooth android like,2026-04-30,3
Bought iPhone 17 instead of Oneplus 15 and heavily regretting the decision,BriefAccomplished272,used oneplus half month battery amazing missed io software lmao camera average opposite bought iphone lol,2026-04-30,3
Bought iPhone 17 instead of Oneplus 15 and heavily regretting the decision,z3noo0,understand frustrating sometimes io specially accustomed android would highly suggest give time get accustomed io comfortable io going back always return io trying android switched ultra base iphone iphone better primary camera better ultrawide camera much much better front camera better speaker much better app compatibility much thing genuinely miss android keyboard notification system even enough ditch iphone give time see,2026-04-30,2
Bought iPhone 17 instead of Oneplus 15 and heavily regretting the decision,Sweet-Lack-86,qui fait pas iphone est oneplus depuis toujours sur iphone vous pensez pa tre content bah changez simplement,2026-04-30,2
Bought iPhone 17 instead of Oneplus 15 and heavily regretting the decision,Sagrada_Familia-free,wenn noch apple watch dazu kaufst wirst nicht mehr bereuen,2026-04-30,2
Bought iPhone 17 instead of Oneplus 15 and heavily regretting the decision,Status-Usual-6561,siri backed gemini coming pretty soon likely less powerful secure privacy oriented heard issue though iphone pretty powerful device consistent one day battery definitely going get level battery considering half battery capacity totally different phone experience really io great apple product care versatility definitely give week fan sell get good thing get best resale value compared phone market iphone hold price really well,2026-04-30,2
Bought iPhone 17 instead of Oneplus 15 and heavily regretting the decision,blue0231,one plus dog shit,2026-04-30,2
Bought iPhone 17 instead of Oneplus 15 and heavily regretting the decision,Dreadpirateflappy,switched samsung iphone amazing choice care want phone phone shit take nice picture battery last almost day base light use lasted around half time battery health shit year,2026-04-30,2
Bought iPhone 17 instead of Oneplus 15 and heavily regretting the decision,yezzedman,state base previous year experience io iphone surely believe statement time change platform trying iphone fun hence convince youtuber point statement valid different field different game next time try harder,2026-05-05,2
Bought iPhone 17 instead of Oneplus 15 and heavily regretting the decision,neperjr,asking think getting pro fix issue,2026-04-30,2
Bought iPhone 17 instead of Oneplus 15 and heavily regretting the decision,Murky_Fan_5483,switched android iphone couple month back far going great apart battery drain idle day tried oneplus store always impression iphones smooth man god damn smooth unbelievable instantly regretted buying instead plus bigger battery bonus cheaper dedicated telephoto lens understand going,2026-04-30,1
Bought iPhone 17 instead of Oneplus 15 and heavily regretting the decision,Ill-Plate-4575,definitely oneplus iphone oneplus battery life day night oneplus feel much snappier overall camera versatile gaming top notch charging speed insane compared iphone,2026-04-30,1
Bought iPhone 17 instead of Oneplus 15 and heavily regretting the decision,champagnepapi_7,yes battery life mid heat alot,2026-04-30,1
Bought iPhone 17 instead of Oneplus 15 and heavily regretting the decision,RoccoReviews,issue replaced base even worse got pro max replace even disappointed currently perfect although sometimes wish telephoto phone pixel pro though need iphone single camera,2026-04-30,1
Bought iPhone 17 instead of Oneplus 15 and heavily regretting the decision,Lucky_Outside_2009,iphone battery crushing every phone test start since recent update everyone know struggling meanwhile chose brand stable experience heating expected since cooling system like pro series samsung even fit vapor chamber cooling ultra thin edge titanium phone sure apple fit simple one base iphone heat biggest killer apparently base iphone cost cutting done well based leak regret getting pro tbh,2026-04-30,0
Bought iPhone 17 instead of Oneplus 15 and heavily regretting the decision,Planckarte,agree point coming pixel even mid range phone feel better everything come io bad nice interface already macbook apple ipad staying ecosystem man sad mac freaking great expecting iphones io lack every aspect,2026-04-30,0
Bought iPhone 17 instead of Oneplus 15 and heavily regretting the decision,Generalrossa,android better depending skin oem use always way versatile point smoother io lol,2026-04-30,0
Bought iPhone 17 instead of Oneplus 15 and heavily regretting the decision,Sandra_H_H,despite undoubtedly existing restriction camera battery pwm apple technological leadership remains uncontested competition various android satellite satellite emergency call faceid online offline backup entire device encrypted computer password set battalion apps exist android day including procamera goodreader goodnotes document leicacamera example others long lasting battery technology best resale six year update plus several year security update onward excelling video quality incl audio strict privacy policy including apple pay lockdown mode best instagram result high life expectancy due top performance processor good usability exemplary set barrier free function good voice recognition also offline inpressing ecosystem including hardware airtags airpods watch word android including oneplus many central basic still missing chn advantage given many top smartphones term camera battery technology cannot make shortcoming,2026-04-30,0
Bought iPhone 17 instead of Oneplus 15 and heavily regretting the decision,luizpaulo87,sai para iphone diferen termal gritante unica coisa que realmente sinto falta circular para pesquisar lente telefoto resto iphone ganha todos aspectos incrivelmente bateria,2026-05-03,2
Bought iPhone 17 instead of Oneplus 15 and heavily regretting the decision,Key-Consequence-2709,change bro always enjoy trying new thing regret come later lol,2026-04-30,-16
Bought iPhone 17 instead of Oneplus 15 and heavily regretting the decision,Riser_5888,justifying poor quality restricted us phone cost bomb lol,2026-04-30,-11
Bought iPhone 17 instead of Oneplus 15 and heavily regretting the decision,Key-Consequence-2709,wanted experience iphone life bought change,2026-04-30,-1
Bought iPhone 17 instead of Oneplus 15 and heavily regretting the decision,Otac_Velizar,day ago half hour screen time blew mind,2026-05-03,2
Bought iPhone 17 instead of Oneplus 15 and heavily regretting the decision,Key-Consequence-2709,nope shutting country,2026-04-30,1
Bought iPhone 17 instead of Oneplus 15 and heavily regretting the decision,Key-Consequence-2709,wait till someone steal device find face unreliable someone snatch phone unlocks using face fingerprint sensor reliable opinion,2026-04-30,2
Bought iPhone 17 instead of Oneplus 15 and heavily regretting the decision,Key-Consequence-2709,well changed device fun change experience good try new try thing every everyone complaining battery life apple providing unnecessary buggy software update uncommon get bug pay dollar phone different field different game experience premium missing understood point,2026-05-05,1
Bought iPhone 17 instead of Oneplus 15 and heavily regretting the decision,Key-Consequence-2709,idk io problem part pro also face draining issue well,2026-04-30,3
Bought iPhone 17 instead of Oneplus 15 and heavily regretting the decision,AutoModerator,subreddit account requirement broken rule account still active good standing please check notification information bot action performed automatically please contact moderator subreddit message compose question concern,2026-04-30,1
Bought iPhone 17 instead of Oneplus 15 and heavily regretting the decision,Key-Consequence-2709,yeah ikr hope get fixed io else done apple,2026-04-30,1
Bought iPhone 17 instead of Oneplus 15 and heavily regretting the decision,Unlikely-Wedding-975,yea man seeing hope patch,2026-04-30,-1
Bought iPhone 17 instead of Oneplus 15 and heavily regretting the decision,Common_Floor_7195,mac really great use professional purpose like using photoshop final cut pro editing photo video people professional use desktop laptop gaming done window time curious thought,2026-04-30,-2
Bought iPhone 17 instead of Oneplus 15 and heavily regretting the decision,Key-Consequence-2709,tried color try difference animation also minimal bug,2026-04-30,1
Bought iPhone 17 instead of Oneplus 15 and heavily regretting the decision,Key-Consequence-2709,yeah man really heavy gaming charge time day,2026-04-30,3
Bought iPhone 17 instead of Oneplus 15 and heavily regretting the decision,T-K101,many compared sale,2026-04-30,0
Bought iPhone 17 instead of Oneplus 15 and heavily regretting the decision,Fearless_Purchase406,also switched iphone iphone great experience honestly solid experience,2026-05-03,1
Bought iPhone 17 instead of Oneplus 15 and heavily regretting the decision,Repulsive-Degree-816,teria que comparar com iphone assim cil quem diria que ano seria pior que uau,2026-05-03,1
Bought iPhone 17 instead of Oneplus 15 and heavily regretting the decision,Fearless_Purchase406,bro try expensive okay iphone better pick rather pro good choice need regret think io fix bug,2026-04-30,10
Bought iPhone 17 instead of Oneplus 15 and heavily regretting the decision,robblake44,say give bit longer like easily sell get phone wanted hard one people know liked iphone went back samsung ultra,2026-04-30,11
Bought iPhone 17 instead of Oneplus 15 and heavily regretting the decision,Ash16pm,yea good phone battery life,2026-05-03,1
Bought iPhone 17 instead of Oneplus 15 and heavily regretting the decision,Wudu_Gang,use face unlock face attentive everything like android face us camera iphone actually biometric sensor screen,2026-05-03,1
Bought iPhone 17 instead of Oneplus 15 and heavily regretting the decision,Sideburn_Cookie_Man,funny pro issue io,2026-04-30,2
Bought iPhone 17 instead of Oneplus 15 and heavily regretting the decision,Sideburn_Cookie_Man,yes mac really great,2026-04-30,5
Bought iPhone 17 instead of Oneplus 15 and heavily regretting the decision,Wizard_of_Bore,game linux mac day window spyware,2026-04-30,4
Bought iPhone 17 instead of Oneplus 15 and heavily regretting the decision,Generalrossa,yeah seen video one phone look smooth,2026-04-30,0
Bought iPhone 17 instead of Oneplus 15 and heavily regretting the decision,neperjr,damn crazy time lot,2026-04-30,5
Bought iPhone 17 instead of Oneplus 15 and heavily regretting the decision,Unlikely-Wedding-975,damn thought normal,2026-04-30,1
Bought iPhone 17 instead of Oneplus 15 and heavily regretting the decision,luizpaulo87,goat do base nova gera,2026-05-04,2
Bought iPhone 17 instead of Oneplus 15 and heavily regretting the decision,luizpaulo87,problema que realmente tem diferen apenas gera problema que diferen foi gritante microlags com ram tem ram plus reiniciava muito aplicativos,2026-05-04,1
Bought iPhone 17 instead of Oneplus 15 and heavily regretting the decision,Key-Consequence-2709,well say got robbed damn youtubers glazing iphones every moment,2026-04-30,-11
Bought iPhone 17 instead of Oneplus 15 and heavily regretting the decision,bayfox88,face better faster coming hardcore android since iphone,2026-05-06,2
Bought iPhone 17 instead of Oneplus 15 and heavily regretting the decision,iphone17-ModTeam,wedding thank participating unfortunately submission breaking following rule kind others use insult reposting post moderator without express permission allowed please read reddiquette linked question comment concern message moderator reddiquette new content policy,2026-04-30,2
Bought iPhone 17 instead of Oneplus 15 and heavily regretting the decision,Beautiful_Mix8597,nobody said buy decided buy trashing phone android standard iphone meant certain type group one,2026-04-30,3
Bought iPhone 17 instead of Oneplus 15 and heavily regretting the decision,iphone17-ModTeam,thank participating unfortunately submission breaking following rule kind others use insult reposting post moderator without express permission allowed please read reddiquette linked question comment concern message moderator reddiquette new content policy,2026-04-30,2
Bought iPhone 17 instead of Oneplus 15 and heavily regretting the decision,Unlikely-Wedding-975,took searching battery issue argument still knw sale battery issue,2026-04-30,0
Bought iPhone 17 instead of Oneplus 15 and heavily regretting the decision,T-K101,regretting engaging dude asking real number,2026-04-30,2
Bought iPhone 17 instead of Oneplus 15 and heavily regretting the decision,Unlikely-Wedding-975,think every person world owns base model speak battery issue ppl accept without knowing problem,2026-04-30,-2
Bought iPhone 17 instead of Oneplus 15 and heavily regretting the decision,T-K101,bro originally asked simple question hope good exchange became defensive naturally started using hominem opinion based post nothing also sure device problem sold million good one,2026-04-30,2
Honest review,Euphoric-Ear9405,moved mini pro big upgrade,2026-03-03,11
Honest review,gary_oak16,amazing phone size perfect performance great handle every task ease really good camera feel like people exaggerate lot talk heating problem never issue germany seems like depends live battery life solid enough although admit great battery life even better regard thing see advantage everything else well think regret buying either,2026-03-03,7
Honest review,sriusbsnis,best thing usbc sure get new cable,2026-03-03,2
Honest review,Emotional-Mode1602,using battery life everything used capacity weight pro get used battery life carry power bank around series still worth,2026-03-03,2
Honest review,fackyouman,perfect upgrade also upgraded mini pro feel nice hand use light case key use black spigen case type mini battery fine easily better mini trip need preserve low power mode work fantastic honestly take battery life mean lighter phone pro enticing thermal fine get little hot warm outside mini would hot use time plugged using carplay,2026-03-03,2
Honest review,No_Assignment7385,went nothing great experience obviously bigger standard pro use one month back excellent phone great build screen performance camera name battery pro max great pro fair bit less might better mini thermal issue despite expecting cooler say definitely worth good luck search,2026-03-04,2
Honest review,trunks_ho,pro amazing know concerned thermal battery base iphone better,2026-03-04,2
Honest review,kennyballsack,far using well pro must say pro power button get way time accidentally clicking play game rotate phone screen slightly smaller maybe need getting used also video safari could played reason couldnt even load pro perhaps internet issue ouh camera fun amazing zoom quality got version,2026-03-04,2
Honest review,Junior_Persimmon_346,went mini pro happier,2026-03-04,2
Honest review,Leech-64,pro really solid phone upgraded miss,2026-03-04,2
Honest review,feelingrestless_,bought pro september upgrading mini size weight increase relatively easy adjust use case mini battery garbage pro show slight improvement least get workday honestly back forth pro time favorite iphone due apology beloved mini,2026-03-03,1
Honest review,Sparkyspacedragon,also consider base,2026-03-03,1
Honest review,ThrowRAMystic802,moved mini pro nov got used couple day tbh probably last pro phone manageable term screen size coming mini last pro phone screen say big compared recent iphones made love wish lighter like mini,2026-03-03,1
Honest review,throwaway3905463,love maybe would best newer design thermal issue fixed,2026-03-03,1
Honest review,arnaudoff,base pro owner year since released otoh recently played base say amazing,2026-03-07,1
Honest review,deleted,upgrade mini pro phone time consider pro pro max long time use like mini upto year one thing buy original condition well like chazing battey health stay original year old phone maintain health,2026-03-30,1
Honest review,vixany,battery life going good year half done thing keep happening otherwise distinctly great upgrade video excellent everything else edit add took road trip plugged using location map overheated,2026-03-04,1
Honest review,onkek,battery life indeed shit actually phone reasonable normal amount time make evening would strongly look pro beyond depending budget,2026-03-03,0
Honest review,Skm67gm,old pro terrible slow ran hot battery life awful,2026-03-04,0
Honest review,Temporary_Horror_120,whats biggest change,2026-03-03,2
Honest review,Temporary_Horror_120,thank neighbor poland last day,2026-03-03,3
Honest review,AssumptionLive1614,get battery percentage,2026-03-04,1
Honest review,Temporary_Horror_120,shouldnt problem,2026-03-03,1
Honest review,Temporary_Horror_120,good know battery life sir pro get thru day,2026-03-03,1
Honest review,HuckleCatt1,use encased rebel case really good light,2026-03-06,1
Honest review,Temporary_Horror_120,much diff mini pro battery life,2026-03-03,1
Honest review,Temporary_Horror_120,yeah even ordered know feel good also much fan design refurbished pro apple also cheaper thats considering,2026-03-03,1
Honest review,Temporary_Horror_120,battery life satisfied,2026-03-03,1
Honest review,Temporary_Horror_120,right price good even expensive base,2026-03-03,1
Honest review,Temporary_Horror_120,thanks tell like,2026-03-07,1
Honest review,Euphoric-Ear9405,mainly battery screen size,2026-03-03,3
Honest review,gary_oak16,greeting yes last whole day gaming regular use whatsapp google map bit youtube etc day come home writing lol,2026-03-03,3
Honest review,fackyouman,yep leave home like around like end day really power hour screen time fine,2026-03-03,1
Honest review,Leech-64,battery aging bit year hoping better battery life pro pro feel like battery pro new also io dumb liked way io looked way better edit btw also went mini pro loved mini transition pro comfortable,2026-03-04,2
Honest review,feelingrestless_,getting hour mini get around hour pro ymmv course,2026-03-03,1
Honest review,DogTweakin,considering base much rather someone used pro better battery life enough sway average also pro got warm reception apps like instagram,2026-03-03,1
Honest review,ThrowRAMystic802,yes cycle left get hour sot daily charge phone twice day rarely,2026-03-03,1
Honest review,arnaudoff,newest lineup cheaper price,2026-03-07,1
Honest review,Temporary_Horror_120,battery life good,2026-03-03,1
Honest review,oklch,use case battery last easy whole day phone since september plan change anytime soon really great phone,2026-03-03,3
Honest review,Temporary_Horror_120,casual game phone pro starting look even tempting,2026-03-03,1
Honest review,Temporary_Horror_120,true io didnt swap battery,2026-03-04,1
Honest review,Temporary_Horror_120,yeah mixed feeling like size design pro also price better,2026-03-03,1
Honest review,Temporary_Horror_120,great know thank,2026-03-03,1
Honest review,Temporary_Horror_120,guess thats acceptable,2026-03-03,1
Honest review,Temporary_Horror_120,right technical perspective big diff pro,2026-03-07,1
Honest review,Euphoric-Ear9405,honestly better mini sure compare pro max thinking upgrade,2026-03-03,1
Honest review,gary_oak16,yeah also plan use least year maybe change battery day even know love thing,2026-03-03,3
Honest review,gary_oak16,saying regret buying problem people describe somewhat exaggerated luxury problem applies though high end smartphones,2026-03-03,2
Honest review,Leech-64,ive tried self iphone broke volume button wasnt pay someone install new one also att got fantastic trade deal pretty much free year contract made sense,2026-03-04,1
Honest review,feelingrestless_,want add live hot humid climate experienced thermal issue game phone however,2026-03-03,2
Honest review,DogTweakin,reason consider want telephoto lens take advantage raw photo otherwise see advantage battery abysmal reception wifi okay cellular trust pretty bad idk future io update helped someone home time personally deal charging often also consider get software update imo colour option way better probably happy whichever way sweat much,2026-03-03,2
Honest review,XD_Abdullah,like said give better battery life love pro health give like hour sot annoying thermal issue real phone get warm alot doubt natural titanium soo pretty,2026-03-03,1
Honest review,Temporary_Horror_120,much better mini,2026-03-03,1
Honest review,Temporary_Horror_120,agree thank help,2026-03-03,2
Honest review,Temporary_Horror_120,understand thanks input,2026-03-04,2
Honest review,Temporary_Horror_120,neither use phone call texting social medium mostly looking something get thru day cause mini hard even new battery,2026-03-03,1
Honest review,Temporary_Horror_120,thank right mostly wifi would buy pro right concerned amount mixed comment battery heating,2026-03-03,1
Honest review,Temporary_Horror_120,thats color want buy sot battery considering apple refurbished new battery,2026-03-03,1
Honest review,XD_Abdullah,got like hr plus keep mind io since update got deteriorated massively,2026-03-03,1
Honest review,Temporary_Horror_120,reccomend upgrading,2026-03-03,1
Honest review,DogTweakin,wifi aint way got mixed usage,2026-03-03,1
Honest review,XD_Abdullah,worry happy help,2026-03-03,2
Honest review,Sparkyspacedragon,get support update probably,2026-03-04,1
Honest review,XD_Abdullah,yes wifi dont use cellular service,2026-03-03,1
"The iPhone 15 Pro Max is the worst iPhone I’ve ever owned, and I’ve had nearly every major one.",Radiofled,think got lemon pro max best phone ever,2025-04-06,74
"The iPhone 15 Pro Max is the worst iPhone I’ve ever owned, and I’ve had nearly every major one.",Manfred_89,best iphone ever experienced thing older iphones battery issue might show issue bad battery cause maybe getting new battery might fix stuff,2025-04-06,20
"The iPhone 15 Pro Max is the worst iPhone I’ve ever owned, and I’ve had nearly every major one.",Paradox_Timeless,must dud bud mine suffers none issue get checked apple,2025-04-06,13
"The iPhone 15 Pro Max is the worst iPhone I’ve ever owned, and I’ve had nearly every major one.",Red_Ryze_Alert,pro line immense heating issue true pro like month phone nice dare play demanding game take video long known issue pro line fixed,2025-04-06,10
"The iPhone 15 Pro Max is the worst iPhone I’ve ever owned, and I’ve had nearly every major one.",lucalmn,wild mine gas almost two year still work fucking perfect best six iphones owned tho return shit,2025-04-06,6
"The iPhone 15 Pro Max is the worst iPhone I’ve ever owned, and I’ve had nearly every major one.",Awkward-Queen-28,agree pro max worst iphone get overheating issue glitching freezing app crashing keyboard disappearing carplay issue beyond frustrating mine little year battery life complete garbage loses approx battery workday hardly phone day considering trading upgrade pro,2025-06-12,5
"The iPhone 15 Pro Max is the worst iPhone I’ve ever owned, and I’ve had nearly every major one.",PittsMaNews,blue iphone pro max never heating issue,2025-07-18,5
